Name,Slug,Collection ID,Item ID,Created On,Updated On,Published On,External Link,Thumbnail,short description,long description,Category,Resource Type
Pod Save the People (Crooked Media),pod-save-the-people-crooked-media,5ee2e19f496d2260820fd718,5ee2e8369d2c574932a916be,Fri Jun 12 2020 02:28:06 GMT+0000 (Coordinated Universal Time),Sat Jun 13 2020 17:25:03 GMT+0000 (Coordinated Universal Time),Sat Jun 13 2020 17:53:49 GMT+0000 (Coordinated Universal Time),https://crooked.com/podcast-series/pod-save-the-people/,https://uploads-ssl.webflow.com/5edfdc4615dbd34ff38974f4/5ee50beda21f7b2c741c3a61_pod%20save%20the%20people%20icon.jpg,"On Pod Save the People, experts, influencers, and diverse local and national leaders who come on the show go deep on social, political, and cultural issues.On Pod Save the People,","<p>On Pod Save the People, organizer and activist DeRay Mckesson explores news, culture, social justice, and politics with fellow activists Brittany Packnett Cunningham and Sam Sinyangwe, and writer Dr. Clint Smith. They offer a unique take on the news, with a special focus on overlooked stories and topics that often impact people of color. There’s also a weekly one-on-one interview with DeRay and special guests, from singer/songwriter John Legend to Speaker of the House Nancy Pelosi. The experts, influencers, and diverse local and national leaders who come on the show go deep on social, political, and cultural issues. New episodes every Tuesday.</p>",Education,Podcasts
Pod For The Cause (from The Leadership Conference on Civil & Human Rights),pod-for-the-cause-from-the-leadership-conference-on-civil-human-rights,5ee2e19f496d2260820fd718,5ee2e8363b11781cc9ce6bd7,Fri Jun 12 2020 02:28:06 GMT+0000 (Coordinated Universal Time),Sat Jun 13 2020 17:25:14 GMT+0000 (Coordinated Universal Time),Sat Jun 13 2020 17:53:49 GMT+0000 (Coordinated Universal Time),https://civilrights.org/podforthecause/,https://uploads-ssl.webflow.com/5edfdc4615dbd34ff38974f4/5ee50bf9ed4e85d9417d22e6_pod%20for%20the%20cause%20icon.png,"This podcast was created for those of you wanting to effect change, who understand the importance of restoring our democracy and want to engage in deep conversation around the issues.","<p>We’ve joined the airwaves to help spark conversation and activism on some of the most critical issues of today.From the courts to immigration, we’re seeing unprecedented attacks on the values we hold near and dear. At Pod for the Cause, we’re going to tackle these issues and more. Our friends in the movement will be stopping by to have these conversations, and they promise to be real, straightforward and honest.This podcast was created for those of you wanting to effect change, who understand the importance of restoring our democracy and want to engage in deep conversation around the issues.</p>",Education,Podcasts
Momentum: A Race Forward Podcast,momentum-a-race-forward-podcast,5ee2e19f496d2260820fd718,5ee2e836eb48482fdd145e37,Fri Jun 12 2020 02:28:06 GMT+0000 (Coordinated Universal Time),Sat Jun 13 2020 17:25:26 GMT+0000 (Coordinated Universal Time),Sat Jun 13 2020 17:53:49 GMT+0000 (Coordinated Universal Time),https://www.raceforward.org/media/podcast/momentum-race-forward-podcast,https://uploads-ssl.webflow.com/5edfdc4615dbd34ff38974f4/5ee50c04ebf1ac9b976af213_RaceForward_Podcast_Momentum_Graphic9_vh_0.jpg,"""Momentum: A Race Forward Podcast"" features movement voices, stories, and strategies for racial justice.","<p>Momentum: A Race Forward Podcast features movement voices, stories, and strategies for racial justice. Co-hosts Chevon and Hiba give their unique takes on race and pop culture, and uplift narratives of hope, struggle, and joy, as we continue to build the momentum needed to advance racial justice in our policies, institutions, and culture. Build on your racial justice lens and get inspired to drive action by learning from organizational leaders and community activists.</p>",Education,Podcasts
Intersectionality Matters! hosted by Kimberlé Crenshaw,intersectionality-matters-hosted-by-kimberle-crenshaw,5ee2e19f496d2260820fd718,5ee2e835e473417b7fbd8517,Fri Jun 12 2020 02:28:05 GMT+0000 (Coordinated Universal Time),Sat Jun 13 2020 17:26:10 GMT+0000 (Coordinated Universal Time),Sat Jun 13 2020 17:53:49 GMT+0000 (Coordinated Universal Time),https://podcasts.apple.com/us/podcast/intersectionality-matters/id1441348908,https://uploads-ssl.webflow.com/5edfdc4615dbd34ff38974f4/5ee50c2c7da456222b62e3e0_intersectionality%20matters%20icon.jpg,The podcast that brings intersectionality to life,"<p>Intersectionality Matters! is a podcast hosted by Kimberlé Crenshaw, an American civil rights advocate and a leading scholar of critical race theory.</p>",Education,Podcasts
Code Switch (NPR),code-switch-npr,5ee2e19f496d2260820fd718,5ee2e835add9ef0036b71fc1,Fri Jun 12 2020 02:28:05 GMT+0000 (Coordinated Universal Time),Sat Jun 13 2020 17:33:26 GMT+0000 (Coordinated Universal Time),Sat Jun 13 2020 17:53:49 GMT+0000 (Coordinated Universal Time),https://www.npr.org/sections/codeswitch/,https://uploads-ssl.webflow.com/5edfdc4615dbd34ff38974f4/5ee50c5c474110e5a231ff2f_npr%20codeswitch%20icon.jpg,"We're a multi-racial, multi-generational team of journalists fascinated by the overlapping themes of race, ethnicity and culture.","<p>Remember when folks used to talk about being ""post-racial""? Well, we're definitely not that. We're a multi-racial, multi-generational team of journalists fascinated by the overlapping themes of race, ethnicity and culture, how they play out in our lives and communities, and how all of this is shifting.</p>",Education,Podcasts
About Race,about-race,5ee2e19f496d2260820fd718,5ee2e835bad6470ee8504fa5,Fri Jun 12 2020 02:28:05 GMT+0000 (Coordinated Universal Time),Sat Jun 13 2020 17:33:55 GMT+0000 (Coordinated Universal Time),Sat Jun 13 2020 17:53:49 GMT+0000 (Coordinated Universal Time),https://www.showaboutrace.com/,https://uploads-ssl.webflow.com/5edfdc4615dbd34ff38974f4/5ee50c69ed4e85b1fb7d2333_square-about-race-squarespace.jpg,"Co-discussants host a lively multiracial, interracial conversation about the ways we talk about culture, identity, politics, power, and privilege in America.","<p>Co-discussants Anna Holmes, Baratunde Thurston, Raquel Cepeda and Tanner Colby host a lively multiracial, interracial conversation about the ways we can’t talk, don’t talk, would rather not talk, but intermittently, fitfully, embarrassingly do talk about culture, identity, politics, power, and privilege in our pre-post-yet-still-very-racial America. This show is ""About Race.""</p>",Education,Podcasts
1619 (New York Times),1619-new-york-times,5ee2e19f496d2260820fd718,5ee2e8359437ea433cc27ce2,Fri Jun 12 2020 02:28:05 GMT+0000 (Coordinated Universal Time),Sat Jun 13 2020 17:34:06 GMT+0000 (Coordinated Universal Time),Sat Jun 13 2020 17:53:49 GMT+0000 (Coordinated Universal Time),https://www.nytimes.com/2020/01/23/podcasts/1619-podcast.html,https://uploads-ssl.webflow.com/5edfdc4615dbd34ff38974f4/5ee50c77fe6691108352ab7a_1619-album-art-superJumbo.jpg,"“1619” is a New York Times audio series, hosted by Nikole Hannah-Jones, that examines the long shadow of American slavery.","<p>Four hundred years ago, in August 1619, a ship carrying more than 20 enslaved Africans arrived in the English colony of Virginia. No aspect of the country that would be formed here has been untouched by the 250 years of slavery that followed.“1619,” a New York Times audio series hosted by Nikole Hannah-Jones, examines the long shadow of that fateful moment.</p>",Education,Podcasts
Raising Free People,raising-free-people,5ee2e19f496d2260820fd718,5ee2e8349d2c57516ca916bd,Fri Jun 12 2020 02:28:04 GMT+0000 (Coordinated Universal Time),Sat Jun 13 2020 17:37:07 GMT+0000 (Coordinated Universal Time),Sat Jun 13 2020 17:53:49 GMT+0000 (Coordinated Universal Time),https://www.raisingfreepeople.com/podcast/,https://uploads-ssl.webflow.com/5edfdc4615dbd34ff38974f4/5ee50ec01f082171e4c08248_Raising%20Free%20people.jpg,"Fare of the Free Child is a weekly-published podcast community centering Black people, Indigenous people, and People of Color in liberatory living and learning practices.","<p>Fare of the Free Child is a weekly-published podcast community centering Black people, Indigenous people, and People of Color in liberatory living and learning practices. With a particular interest in unschooling and the Self-Directed Education movement, Akilah S. Richards and guests discuss the fears and the fares (costs) of raising free black and brown children in a world that tends to diminish, dehumanize, and disappear them.</p>",Education,Podcasts
Parenting Forward,parenting-forward,5ee2e19f496d2260820fd718,5ee2e834add9efbe28b71fc0,Fri Jun 12 2020 02:28:04 GMT+0000 (Coordinated Universal Time),Sun Jun 14 2020 18:05:44 GMT+0000 (Coordinated Universal Time),Sun Jun 14 2020 18:06:27 GMT+0000 (Coordinated Universal Time),https://podcasts.apple.com/us/podcast/parenting-forward/id1403686245?i=1000474951309,https://uploads-ssl.webflow.com/5edfdc4615dbd34ff38974f4/5ee50eeabc35f75056c826a6_parenting%20forward.jpg,Cindy Wang Brandt is a mother and progressive Christian writer who is on a mission to support the journeys of parents interested in Parenting Forward with progressive values.,"<p>Cindy Wang Brandt is a mother and progressive Christian writer who is on a mission to support the journeys of parents interested in Parenting Forward with progressive values. She's an author, blogger, community leader, coach, and live and online education provider for parents who are committed to raising their kids in a faith that isn't hierarchical, controlling and fundamentalist and want to see their children desire mercy and not sacrifice, to grow up walking in the ways of Jesus for peace, righteousness, and wholeness! The Parenting Forward podcast features interviews with authors and thought leaders from progressive faith spaces, monthly listener question shows, and practical strategies for parents, grandparents, and anyone who loves children and wants to commit to treating children with justice. We believe that if we change the way we parent, we can change the world!</p>",Education,Podcasts
