Name,Slug,Collection ID,Item ID,Created On,Updated On,Published On,External Link,Thumbnail,short description,long description,Category,Resource Type
Bodega Boys,bodega-boys,5ee2e19f496d2260820fd718,5ee2e83be25a0c7846b3c35b,Fri Jun 12 2020 02:28:11 GMT+0000 (Coordinated Universal Time),Sat Jun 13 2020 17:41:35 GMT+0000 (Coordinated Universal Time),Sat Jun 13 2020 17:53:49 GMT+0000 (Coordinated Universal Time),https://open.spotify.com/show/2ZgrSa9Ar0EAdlitOiMC6r?si=c6bzW69uTW2HSxI0_hReYw,https://uploads-ssl.webflow.com/5edfdc4615dbd34ff38974f4/5ee50fcc5819c45450e7e0da_bodega%20boys%20icon.jpg,Desus Nice (@Desusnice) and The Kid Mero (@thekidmero) are the Bodega Boys,<p>Desus Nice (@Desusnice) and The Kid Mero (@thekidmero) are the Bodega Boys</p>,Resource,Podcasts
Black Men Can't Jump [In Hollywood],black-men-cant-jump-in-hollywood,5ee2e19f496d2260820fd718,5ee2e83b21e746df9b26c5c5,Fri Jun 12 2020 02:28:11 GMT+0000 (Coordinated Universal Time),Sat Jun 13 2020 17:18:32 GMT+0000 (Coordinated Universal Time),Sat Jun 13 2020 17:53:49 GMT+0000 (Coordinated Universal Time),https://www.stitcher.com/podcast/forever-dog-podcast-network/black-men-cant-jump-in-hollywood,https://uploads-ssl.webflow.com/5edfdc4615dbd34ff38974f4/5ee50a655b8c1bc9372209c5_black%20men%20cant%20jump%20icon.jpg,Black Men Can't Jump [In Hollywood] is a comedic podcast that reviews films with leading actors of color and analyzes them in the context of race and Hollywood's diversity issues.,"<p>Black Men Can't Jump [In Hollywood] is a comedic podcast that reviews films with leading actors of color and analyzes them in the context of race and Hollywood's diversity issues. Hosted by Jonathan Braylock, Jerah Milligan, and James III. BMCJ is an iTunes Editor's Choice podcast and has reached #2 on the iTunes Film/TV charts. BMCJ has also been covered by multiple websites including Huffington Post, Splitsider, Salon, The Daily Dot, and more. Produced by the Forever Dog Podcast Network.</p>",Resource,Podcasts
Locally Famous by Jacolby,locally-famous-by-jacolby,5ee2e19f496d2260820fd718,5ee2e83a990f029a18cfc3a6,Fri Jun 12 2020 02:28:10 GMT+0000 (Coordinated Universal Time),Sun Jun 14 2020 17:57:13 GMT+0000 (Coordinated Universal Time),Sun Jun 14 2020 18:06:27 GMT+0000 (Coordinated Universal Time),https://podcasts.apple.com/us/podcast/locally-famous/id1503599998,https://uploads-ssl.webflow.com/5edfdc4615dbd34ff38974f4/5ee664f7d99a795be5a7db04_Locally%20Famous.jpg,Come along and join Jacolby Conway on the road to become “Locally Famous” !,"<p>Come along and join Jacolby Conway on the road to become “Locally Famous” ! You never know who might pop up, what’s on sale or what the topic of choice may be...but there will ALWAYS be something everyone can relate to. If you don’t know who he is, get to know him!</p>",Resource,Podcasts
Balanced Black Girl,balanced-black-girl,5ee2e19f496d2260820fd718,5ee2e83a5a0fa8f416897911,Fri Jun 12 2020 02:28:10 GMT+0000 (Coordinated Universal Time),Sat Jun 13 2020 17:19:29 GMT+0000 (Coordinated Universal Time),Sat Jun 13 2020 17:53:49 GMT+0000 (Coordinated Universal Time),https://balancedblackgirl.libsyn.com,https://uploads-ssl.webflow.com/5edfdc4615dbd34ff38974f4/5ee50a9e7d4707d860a86089_balanced%20black%20girl%20icon.jpg,Balanced Black Girl is a podcast dedicated to helping you feel your best.,"<p>Balanced Black Girl is a podcast dedicated to helping you feel your best. Tune in for approachable health, self-care, personal development, and well-being advice from Black women wellness experts.</p>",Resource,Podcasts
Black Girl Podcast,black-girl-podcast,5ee2e19f496d2260820fd718,5ee2e83a21e7462b4926c5c4,Fri Jun 12 2020 02:28:10 GMT+0000 (Coordinated Universal Time),Sun Jun 14 2020 18:00:03 GMT+0000 (Coordinated Universal Time),Sun Jun 14 2020 18:06:27 GMT+0000 (Coordinated Universal Time),https://soundcloud.com/BLACKGIRLPODCAST,https://uploads-ssl.webflow.com/5edfdc4615dbd34ff38974f4/5ee665a0921007bad6f5df22_black%20girl%20podcast.jpg,"The Black Girl Podcast is a new audio series about life issues, sisterhood, pop culture, love, growth, and the pursuit of [the hosts'] dreams.","<p>The Black Girl Podcast is a new audio series created by Scottie Beam (@scottiebeam on twitter/IG), Gia Peppers (@giapeppers), Sapphira (@sapphiraem), Bex (@BexxFrancois), and Alysha P (@AlyshaP819/@AlyshaP). After the five media phenoms met and became friends at hip hop's most iconic station, Hot 97, they decided to make their hilarious conversations about life issues, sisterhood, pop culture, love, growth, and the pursuit of their dreams to the public. Listen every week as their differing opinions and life experiences lead them to understand themselves, and the world around them, a little bit better. Hopefully, you'll laugh, argue, and learn something about yourselves, too. Follow us on Twitter and IG @blackgirlpod.</p>",Resource,Podcasts
Black Girls Heal,black-girls-heal,5ee2e19f496d2260820fd718,5ee2e83a91871353bf5f3888,Fri Jun 12 2020 02:28:10 GMT+0000 (Coordinated Universal Time),Sat Jun 13 2020 17:20:10 GMT+0000 (Coordinated Universal Time),Sat Jun 13 2020 17:53:49 GMT+0000 (Coordinated Universal Time),https://podknife.com/podcasts/black-girls-heal,https://uploads-ssl.webflow.com/5edfdc4615dbd34ff38974f4/5ee50ac3a21f7b36551c39b3_BGH_podcastcover.png,Black Girls Heal helps women break out of cycles of unhealthy relationships with unavailable partners and feeling not enough.,"<p>Black Girls Heal helps women break out of cycles of unhealthy relationships with unavailable partners and feeling not enough by combining coaching, therapeutic support, and practical tools.Every episode, we will talk about intimacy, attachment, healing unresolved trauma, and growing in our self worth.</p>",Resource,Podcasts
"Yes, Girl",yes-girl,5ee2e19f496d2260820fd718,5ee2e83a21e74666cf26c5c3,Fri Jun 12 2020 02:28:10 GMT+0000 (Coordinated Universal Time),Sun Jun 14 2020 17:55:37 GMT+0000 (Coordinated Universal Time),Sun Jun 14 2020 18:06:27 GMT+0000 (Coordinated Universal Time),https://www.stitcher.com/podcast/cadence13/yes-girl,https://uploads-ssl.webflow.com/5edfdc4615dbd34ff38974f4/5ee580bb7233d091e43e13fa_TB%20Logo.svg,"The award-nominated, podcast fills your glass with celebrity interviews, pop culture and unapologetic perspective.","<p>At Black Girl Magic headquarters, senior editors Cori Murray (@corimurray), Charli Penn (@ManWifeDog) host ESSENCE's Yes, Girl! Podcast every Thursday. The award-nominated, podcast fills your glass with celebrity interviews, pop culture and unapologetic perspective. From week-to-week, they're uplifting everybody who’s taking Black culture a little higher.</p>",Resource,Podcasts
Carefree and Black Diaries,carefree-and-black-diaries,5ee2e19f496d2260820fd718,5ee2e8396f0e2f3c7d968a46,Fri Jun 12 2020 02:28:09 GMT+0000 (Coordinated Universal Time),Sun Jun 14 2020 18:01:07 GMT+0000 (Coordinated Universal Time),Sun Jun 14 2020 18:06:27 GMT+0000 (Coordinated Universal Time),https://anchor.fm/carefreenblkdiaries,https://uploads-ssl.webflow.com/5edfdc4615dbd34ff38974f4/5ee665e0b699d6da2a999c91_carefree%20and%20black%20diaries.jpg,"We discuss everything from culture, politics, music, and education. But with a dash of hood on the rocks.","<p>Welcome to Carefree and Black Diaries, where we discuss everything from culture, politics, music, and education. But with a dash of hood on the rocks. Just a Black Girl navigating this thing called life and documenting it along the way.Hosted by Shaakira White</p>",Resource,Podcasts
Therapy for Black Girls,therapy-for-black-girls,5ee2e19f496d2260820fd718,5ee2e8391c268c918558be9c,Fri Jun 12 2020 02:28:09 GMT+0000 (Coordinated Universal Time),Sun Jun 14 2020 18:03:31 GMT+0000 (Coordinated Universal Time),Sun Jun 14 2020 18:06:27 GMT+0000 (Coordinated Universal Time),https://therapyforblackgirls.com/podcast/,https://uploads-ssl.webflow.com/5edfdc4615dbd34ff38974f4/5ee666707580a11d57934888_TBG_Podcast_Cover.png,"The Therapy for Black Girls Podcast is a weekly chat about all things mental health, personal development, and all the small decisions we can make to become the best possible versions of ourselves.","<p>So often the stigma surrounding mental health issues and therapy prevents Black women from taking the step of seeing a therapist. This space was developed to present mental health topics in a way that feels more accessible and relevant.Dr. Joy Harden Bradford is a licensed psychologist, speaker and the host of the wildly popular mental health podcast, Therapy for Black Girls. Her work focuses on making mental health topics more relevant and accessible for Black women and she delights in using pop culture to illustrate psychological concepts. She has been featured in O, The Oprah Magazine, Forbes, Bustle, MTV, Huffington Post, Black Enterprise, Refinery29, Teen Vogue, and Essence.</p>",Resource,Podcasts
The Homecoming Podcast,the-homecoming-podcast,5ee2e19f496d2260820fd718,5ee2e839e473419e7ebd8519,Fri Jun 12 2020 02:28:09 GMT+0000 (Coordinated Universal Time),Sun Jun 14 2020 18:04:46 GMT+0000 (Coordinated Universal Time),Sun Jun 14 2020 18:06:27 GMT+0000 (Coordinated Universal Time),https://podcasts.apple.com/us/podcast/the-homecoming-podcast-with-dr-thema/id1471604689,https://uploads-ssl.webflow.com/5edfdc4615dbd34ff38974f4/5ee50b1abc35f7a35ec82418_homecoming%20podcast.jpg,The Homecoming Podcast with Dr. Thema is a podcast to facilitate your journey home to yourself by providing weekly inspiration and health tips.,"<p>Dr. Thema Bryant-Davis is a licensed psychologist, ordained minister, and sacred artist. Using artistic expression, spirituality, psychology and culture, Dr. Bryant-Davis is an internationally recognized lecturer, performer, and minister.The Homecoming Podcast with Dr. Thema is a podcast to facilitate your journey home to yourself by providing weekly inspiration and health tips. Welcome home!</p>",Resource,Podcasts
The Secret Lives of Black Women,the-secret-lives-of-black-women,5ee2e19f496d2260820fd718,5ee2e839c50a7b13250e56b5,Fri Jun 12 2020 02:28:09 GMT+0000 (Coordinated Universal Time),Sat Jun 13 2020 17:21:45 GMT+0000 (Coordinated Universal Time),Sat Jun 13 2020 17:53:49 GMT+0000 (Coordinated Universal Time),https://www.stitcher.com/podcast/stitcher/the-secret-lives-of-black-women,https://uploads-ssl.webflow.com/5edfdc4615dbd34ff38974f4/5ee50b27f3efc15fcae6eef0_secret%20lives%20of%20black%20women%20icon.jpg,Join close friends Charla Lauriston and Lauren Domino on their hunt for the ‘secrets’ that have helped black women flourish through the bullsh*t.,<p>Join close friends Charla Lauriston and Lauren Domino on their hunt for the ‘secrets’ that have helped black women flourish through the bullsh*t. They connect with guests over shared experiences by wading through everything from sex and self-care to rage and anxiety. Each conversation centers on creating a space for joy with some newfound besties while asking: how do the black women we admire stay incredibly phenomenal?</p>,Resource,Podcasts
H.E.R. Space,h-e-r-space,5ee2e19f496d2260820fd718,5ee2e8397f20ede843a22ba1,Fri Jun 12 2020 02:28:09 GMT+0000 (Coordinated Universal Time),Sat Jun 13 2020 17:21:58 GMT+0000 (Coordinated Universal Time),Sat Jun 13 2020 17:53:49 GMT+0000 (Coordinated Universal Time),https://herspacepodcast.com/,https://uploads-ssl.webflow.com/5edfdc4615dbd34ff38974f4/5ee50b347d47075155a8610e_her%20space%20podcast%20icon.png,"Every Friday, join Dr. Dominique Broussard and Terri Lomax as they initiate authentic conversations on everything from fibroids to fake friends.","<p>In a world where black women are often underrepresented and misunderstood, we need more safe spaces to just… be. Every Friday, join Dr. Dominique Broussard, a college professor and psychologist, and Terri Lomax, a techie and motivational speaker, as they initiate authentic conversations on everything from fibroids to fake friends.If you’re a black woman or woman of color looking for an extra dose of inspiration on the go, pull up a seat and join us on the H.E.R. (Healing, Empowerment, Resilience) Space podcast. Episodes are published every Friday on iTunes, Google Play, Soundcloud, and most platforms where podcasts are played.We can’t wait to meet you, sis. 🙂</p>",Resource,Podcasts
Slay Girl Slay,slay-girl-slay,5ee2e19f496d2260820fd718,5ee2e83840a1910536a30414,Fri Jun 12 2020 02:28:08 GMT+0000 (Coordinated Universal Time),Sat Jun 13 2020 17:31:14 GMT+0000 (Coordinated Universal Time),Sat Jun 13 2020 17:53:49 GMT+0000 (Coordinated Universal Time),https://slaygrlslay.com/category/podcast/,https://uploads-ssl.webflow.com/5edfdc4615dbd34ff38974f4/5ee50b41ed4e8503047d21c6_slay%20girl%20slay%20icon.png,Slay Girl Slay is a media and tech company that showcases the positive narrative of women of color on all platforms.,"<p>Slay Girl Slay is a media and tech company dedicated to inspiring and motivating women of color to take up space in the rooms that they stand in, fiercely go after what they deserve, and show up as their most unapologetic, most authentic self. Whether that’s through our sassy girl chat conversations on our wildly popular podcast, pushing the positive narrative, or the bold community of sisterhood we foster.Slay Girl Slay is a media and tech company that showcases the positive narrative of women of color on all platforms including digital, audio, books, social media, and film.This media and tech company is founded by entrepreneur &amp; podcaster Ashley Leggs.</p>",Resource,Podcasts
Journey to Launch,journey-to-launch,5ee2e19f496d2260820fd718,5ee2e838b8db8f49e4666b5c,Fri Jun 12 2020 02:28:08 GMT+0000 (Coordinated Universal Time),Sat Jun 13 2020 17:22:22 GMT+0000 (Coordinated Universal Time),Sat Jun 13 2020 17:53:49 GMT+0000 (Coordinated Universal Time),https://www.journeytolaunch.com/podcastindex/,https://uploads-ssl.webflow.com/5edfdc4615dbd34ff38974f4/5ee50b4cba95a6bb6c1f88e5_journey%20to%20launch%20icon.png,"Through this site, Journey to Launch, I want to teach you what I’ve learned through a little trial and error and a lot of discipline over the years. My goal is to help you eliminate debt, save more money and increase your net worth.","<p>Hi! I’m Jamila, creator of the blog and podcast, Journey To Launch. I’m a wife and mom of three small children. and I’m a Certified Financial Education Instructor (CFEI). I was born on the gorgeous island of Jamaica and grew up in the famous borough of Brooklyn (#bkallday). Raised by a single mom, I learned the concept of hard work and the value of money at a very early age. While my friends were blowing their money on the latest fads (I admit, I sometimes did too), I was saving for my first real estate property, which I was able to buy right out of college, at the age of 22.The lessons I’ve learned, have allowed me to become savvy in budgeting and all things personal finance. Because of my money habits, my family and I are debt free (besides the mortgage) and are on our way to becoming financially independent by the age of 40. I love to teach, inspire and help others jumpstart their journey to financial freedom!Through this site, Journey to Launch, I want to teach you what I’ve learned through a little trial and error and a lot of discipline over the years. My goal is to help you eliminate debt, save more money and increase your net worth.</p>",Resource,Podcasts
The Black Guy Who Tips,the-black-guy-who-tips,5ee2e19f496d2260820fd718,5ee2e8387437a84bfaa89255,Fri Jun 12 2020 02:28:08 GMT+0000 (Coordinated Universal Time),Sat Jun 13 2020 17:30:57 GMT+0000 (Coordinated Universal Time),Sat Jun 13 2020 17:53:49 GMT+0000 (Coordinated Universal Time),https://www.theblackguywhotips.com/category/podcast-episodes/,https://uploads-ssl.webflow.com/5edfdc4615dbd34ff38974f4/5ee50d2f0258e16f3a18d45e_black%20guy%20who%20tips.jpg,"The Black Guy Who Tips is a podcast from the minds of Rod and Karen, a black, southern married couple who enjoy pop culture, politics and comedy.","<p>The Black Guy Who Tips is a podcast from the minds of Rod and Karen, a black, southern married couple who enjoy pop culture, politics and comedy. Rod and Karen have been together since they were 16 and have been married since 2002. The show has been mentioned in The Huffington Post, The Daily Beast, The Washington Post, The New York Times, The Los Angeles Times, Bloomberg.com, Vox.com, BET.com, and  written about on Ebony.com. The show has also been featured on National Public Radio, Revolt Tv, and  Vice News Tonight on HBO.  Besides consistently being the number one comedy podcast on Podomatic.com and in the top 100 of comedy podcasts on Stitcher Radio, the podcast has featured guests such as, podcasters Keith and Chemda from Keith and the Girl, comedian Roy Wood Jr, Adult Film Star Sara Jay, ESPN contributor Bomani Jones, Journalist Jemele Hill, comedian/activist Elon James White, rapper/singer Phonte Coleman, comedian/writer Rae Sanni, comedian Janelle James, poet/author Bassey Ikpi and NBA Shooting Guard Anthony Morrow among others.</p>",Resource,Podcasts
Black Family Table Talk,black-family-table-talk,5ee2e19f496d2260820fd718,5ee2e838add9ef83c5b71fc2,Fri Jun 12 2020 02:28:08 GMT+0000 (Coordinated Universal Time),Sat Jun 13 2020 17:30:39 GMT+0000 (Coordinated Universal Time),Sat Jun 13 2020 17:53:49 GMT+0000 (Coordinated Universal Time),https://blackfamilytabletalk.com,https://uploads-ssl.webflow.com/5edfdc4615dbd34ff38974f4/5ee50b76f3efc1316ee6ef01_black%20family%20table%20talk.jpg,"Listen in weekly as we discover and share stories, life lessons, and new ways to build a strong black family.","<p>After 30 years of marriage and raising four children, we struggled to stay married and encourage our children to thrive. We want to share what worked for us and what didn't. It is our hope and prayer that by sharing our parenting and marriage story (along with those of others), you will save time, pain, hardship, and most importantly, become inspired. The Black Family Table Talk is a ""kitchen table style"" podcast and blog created to candidly share and discover ways to build the Black family, the foundation of the community. We want to engage and challenge you to join us each week as we explore:How to invigorate Black love with healthy relationship goals.Parenting and the Black family.Voting rights and strengthening the Black community. Black economics and wealth-building.     Join our determined community as we take this journey together. We aim to strengthen our families, put an end to the cycles of dysfunction, and explore ways to become #BlackFamilyStrong.</p>",Resource,Podcasts
Ask a Black Woman,ask-a-black-woman,5ee2e19f496d2260820fd718,5ee2e8385a0fa8cd66897910,Fri Jun 12 2020 02:28:08 GMT+0000 (Coordinated Universal Time),Sat Jun 13 2020 17:23:15 GMT+0000 (Coordinated Universal Time),Sat Jun 13 2020 17:53:49 GMT+0000 (Coordinated Universal Time),https://podcasts.apple.com/us/podcast/ask-a-black-woman/id1349812182,https://uploads-ssl.webflow.com/5edfdc4615dbd34ff38974f4/5ee50b809f82302a80db90f3_ask%20a%20black%20woman%20icon.jpg,This is where you Ask A Black Woman anything but... You betta be ready for a real answer!,<p>This is where you Ask A Black Woman anything but... You betta be ready for a real answer!</p>,Resource,Podcasts
Friends Like Us,friends-like-us,5ee2e19f496d2260820fd718,5ee2e8375a0fa8140689790f,Fri Jun 12 2020 02:28:07 GMT+0000 (Coordinated Universal Time),Sat Jun 13 2020 17:23:27 GMT+0000 (Coordinated Universal Time),Sat Jun 13 2020 17:53:49 GMT+0000 (Coordinated Universal Time),https://podtail.com/podcast/friendslikeus/,https://uploads-ssl.webflow.com/5edfdc4615dbd34ff38974f4/5ee50b8dc1a7f016ffb219a4_friends%20like%20us%20icon.jpg,A podcast featuring women of color with different views on topics hosted by Marina Franklin.,<p>A podcast featuring women of color with different views on topics hosted by Marina Franklin.</p>,Resource,Podcasts
In Black America,in-black-america,5ee2e19f496d2260820fd718,5ee2e8371c268c55f058be9b,Fri Jun 12 2020 02:28:07 GMT+0000 (Coordinated Universal Time),Sat Jun 13 2020 17:31:33 GMT+0000 (Coordinated Universal Time),Sat Jun 13 2020 17:53:49 GMT+0000 (Coordinated Universal Time),https://www.npr.org/podcasts/381443555/in-black-america,https://uploads-ssl.webflow.com/5edfdc4615dbd34ff38974f4/5ee50b9f7233d06c1a3d5102_in%20black%20america%20icon.jpg,"Produced at KUT, In Black America is a long-running, nationally syndicated program dedicated to all facets of the African American experience.","<p>Produced at KUT, In Black America is a long-running, nationally syndicated program dedicated to all facets of the African American experience. John Hanson profiles a diverse selection of current and historically significant figures whose stories help illuminate life in Black America. Guests include civil rights leaders, educators, artists, athletes and writers describing their experiences, achievements and work in chronicling and advancing the quality of African American life.</p>",Resource,Podcasts
The Gifted Connection,the-gifted-connection,5ee2e19f496d2260820fd718,5ee2e837d2f436515ebc05d9,Fri Jun 12 2020 02:28:07 GMT+0000 (Coordinated Universal Time),Sat Jun 13 2020 17:31:51 GMT+0000 (Coordinated Universal Time),Sat Jun 13 2020 17:53:49 GMT+0000 (Coordinated Universal Time),https://anchor.fm/nathan-mcclinton,https://uploads-ssl.webflow.com/5edfdc4615dbd34ff38974f4/5ee50ba892b8eb012f1532a4_the%20gifted%20connection%20icon.jpg,Nathan McClinton is a Millennial Inspirational Enthusiast committed to helping you shatter your untapped potential and live out your dreams!,"<p>Nathan McClinton is a Millennial Inspirational Enthusiast committed to helping you shatter your untapped potential and live out your dreams!The Gifted Connection is your safe place to live, learn, grow, and BECOME your best self! Join me, as I help you to live out your full potential through the expression of your God given Gift! Your Gift is about to Make ROOM for you. The question is...are you ready?</p>",Resource,Podcasts
The New Black Panther Party,the-new-black-panther-party,5ee2e19f496d2260820fd718,5ee2e83701e58116181002bd,Fri Jun 12 2020 02:28:07 GMT+0000 (Coordinated Universal Time),Sat Jun 13 2020 17:24:07 GMT+0000 (Coordinated Universal Time),Sat Jun 13 2020 17:53:49 GMT+0000 (Coordinated Universal Time),https://www.stitcher.com/podcast/blogtalkradio/the-new-black-panther-party,https://uploads-ssl.webflow.com/5edfdc4615dbd34ff38974f4/5ee50bb57c8944006e43fb7c_the%20black%20panther%20party%20icon.jpg,THE OFFICIAL BLOG TALK RADIO SHOW FOR THE NEW BLACK PANTHER PARTY. BLACK POWER ! ALL POWER TO THE PEOPLE !,<p>THE OFFICIAL BLOG TALK RADIO SHOW FOR THE NEW BLACK PANTHER PARTY. BLACK POWER ! ALL POWER TO THE PEOPLE !</p>,Resource,Podcasts
The Nod,the-nod,5ee2e19f496d2260820fd718,5ee2e837e473414f18bd8518,Fri Jun 12 2020 02:28:07 GMT+0000 (Coordinated Universal Time),Sat Jun 13 2020 17:29:17 GMT+0000 (Coordinated Universal Time),Sat Jun 13 2020 17:53:49 GMT+0000 (Coordinated Universal Time),https://gimletmedia.com/shows/the-nod,https://uploads-ssl.webflow.com/5edfdc4615dbd34ff38974f4/5ee50bc17b6fbc0b2c89cf70_the%20nod%20icon.jpeg,"Brittany Luse and Eric Eddings gleefully explore all the beautiful, complicated dimensions of Black life.","<p>The Nod tells the stories of Black life that don’t get told anywhere else. Our show ranges from an explanation of purple drink’s association with Black culture to the story of an interracial drag troupe that traveled the nation in the 1940s. We celebrate the genius, the innovation, and the resilience that is so particular to being Black — in America, and around the world.</p>",Resource,Podcasts
The Friend Zone,the-friend-zone,5ee2e19f496d2260820fd718,5ee2e8369d2c572ee4a916bf,Fri Jun 12 2020 02:28:06 GMT+0000 (Coordinated Universal Time),Sat Jun 13 2020 17:32:06 GMT+0000 (Coordinated Universal Time),Sat Jun 13 2020 17:53:49 GMT+0000 (Coordinated Universal Time),https://soundcloud.com/thefriendzonepodcast,https://uploads-ssl.webflow.com/5edfdc4615dbd34ff38974f4/5ee50bcc18269a03d03db374_the%20friend%20zone%20icon.jpg,"Explore mental health, mental wealth and mental hygiene.","<p>Listen along every Wednesday as Dustin Ross, HeyFranHey &amp; Assante explore mental health, mental wealth and mental hygiene, because who in the hell wants a musty brain?</p>",Resource,Podcasts
Seeing White,seeing-white,5ee2e19f496d2260820fd718,5ee2e83619ecaad71f09974c,Fri Jun 12 2020 02:28:06 GMT+0000 (Coordinated Universal Time),Sat Jun 13 2020 17:33:01 GMT+0000 (Coordinated Universal Time),Sat Jun 13 2020 17:53:49 GMT+0000 (Coordinated Universal Time),https://www.sceneonradio.org/seeing-white/,https://uploads-ssl.webflow.com/5edfdc4615dbd34ff38974f4/5ee50dc7a104da9a1fe0d2ca_seeing%20white.png,Just what is going on with white people? Why? Scene on Radio host and producer John Biewen took a deep dive into these questions.,"<p>Just what is going on with white people? Police shootings of unarmed African Americans. Acts of domestic terrorism by white supremacists. The renewed embrace of raw, undisguised white-identity politics. Unending racial inequity in schools, housing, criminal justice, and hiring. Some of this feels new, but in truth it’s an old story.Why? Where did the notion of “whiteness” come from? What does it mean? What is whiteness for?Scene on Radio host and producer John Biewen took a deep dive into these questions, along with an array of leading scholars and regular guest Dr. Chenjerai Kumanyika, in this fourteen-part documentary series, released between February and August 2017. The series editor is Loretta Williams.</p>",Education,Podcasts
